{
  "format": "SysEx Map",
  "version": "1.0",
  "id": "fs1r-example",
  "name": "FS1R SXM example",
  "description": "Curated selection, not a sales or popularity ranking. No physical synth qualification is claimed.",
  "sources": {
    "fs1r": {
      "url": "https://usa.yamaha.com/files/download/other_assets/4/317954/FS1RE2.PDF",
      "sha256": "8a56852fc0c8f6b0afdcdc64d34ac09995377cb71540791eba1cf00cf8848c66",
      "bytes": 747123,
      "retrieved": "2026-10-29",
      "title": "Yamaha FS1R - manufacturer MIDI documentation"
    }
  },
  "devices": [
    {
      "id": "fs1r",
      "manufacturer": "Yamaha",
      "name": "FS1R",
      "notes": "Native model 5Eh. Part selects Voice Common 40h-43h. All parameter changes carry two value bytes (MS7 then LS7), even for 7-bit values. Enable Receive System Exclusive.",
      "documentation": {
        "sources": [
          "fs1r"
        ],
        "section": "Data List pp.37,39: 3.1 Parameter Change / Voice Common Parameter"
      },
      "parameters": [
        {
          "id": "cutoff",
          "name": "Common filter cutoff",
          "value": {
            "minimum": 0,
            "maximum": 127
          },
          "fields": {
            "device": {
              "name": "Device number",
              "minimum": 1,
              "maximum": 16,
              "default": 1
            },
            "part": {
              "name": "Part",
              "minimum": 1,
              "maximum": 4,
              "default": 1
            }
          },
          "messages": [
            {
              "bytes": [
                240,
                67,
                {
                  "field": "device",
                  "add": 15
                },
                94,
                {
                  "field": "part",
                  "add": 63
                },
                0,
                87,
                {
                  "value": {
                    "shift": 7,
                    "bits": 7,
                    "add": 0
                  }
                },
                {
                  "value": {
                    "shift": 0,
                    "bits": 7,
                    "add": 0
                  }
                },
                247
              ]
            }
          ],
          "effect": "edit-buffer",
          "evidence": "manufacturer-documented"
        }
      ]
    }
  ],
  "extensions": {
    "example.note": "Retain this optional metadata on import/export."
  }
}
